DBN,school_name,math_score,reading_score,writing_score
31R455,TOTTENVILLE HIGH SCHOOL,486,462,470
31R460,SUSAN E. WAGNER HIGH SCHOOL,474,455,459
31R470,CONCORD HIGH SCHOOL,455,466,414
31R600,RALPH R. MCKEE CAREER AND TECHNICAL EDUCATION HIGH SCHOOL,422,416,397
31R605,STATEN ISLAND TECHNICAL HIGH SCHOOL,682,635,636
31R607,YOUNG ADULT BOROUGH CENTER AT STATEN IS TECH HS,375,405,370
32K403,ACADEMY FOR ENVIRONMENTAL LEADERSHIP,366,380,352
32K545,EBC HIGH SCHOOL FOR PUBLIC SERVICE–BUSHWICK,409,384,361
32K549,BUSHWICK SCHOOL FOR SOCIAL JUSTICE,353,348,334
32K552,ACADEMY OF URBAN PLANNING,364,342,354
32K554,ALL CITY LEADERSHIP SECONDARY SCHOOL,465,428,422
32K556,BUSHWICK LEADERS HIGH SCHOOL FOR ACADEMIC EXCELLENCE,358,347,350
32K564,BUSHWICK COMMUNITY HIGH SCHOOL,317,359,358
75K371,P.S. 371 s LILLIAN L. RASHKIS,s,s,s
75M035,P.S. 035,s,s,s
75Q256,P.S. Q256,s,s,s
75Q811,P.S. Q811,444,429,433
75R025,SOUTH RICHMOND HIGH SCHOOL I.S./P.S. 25,s,s,s
75X012,P.S. X012 LEWIS AND CLARK SCHOOL,s,s,s
75X754,J. M. RAPPORT SCHOOL CAREER DEVELOPMENT,s,s,s
79M645,SCHOOL FOR COOPERATIVE TECHNICAL EDUCATION,s,s,s
79Q950,GED PLUS s CITYWIDE,400,496,426
79X490,PHOENIX ACADEMY,370,367,360
79X490,PHOENIX ACADEMY,370,367,360